{
  "version": "0.1",
  "subject": "did:web:proofofyou.com",
  "period": {"from": "2024-01-01", "to": "2025-08-18"},
  "highlights": [
    {
      "type": "reliability_improvement",
      "metric": {"name": "success_rate", "value": 0.992, "window": "Q1 2025"},
      "evidence": [
        {"kind": "dashboard", "url": "https://example.com/grafana/boards/123"},
        {"kind": "ticket", "id": "ENG-2345", "url": "https://jira.example.com/browse/ENG-2345"}
      ],
      "summary": "Improved reliability via safer rollouts and signal tuning."
    },
    {
      "type": "efficiency",
      "metric": {"name": "cost_reduction_pct", "value": 18},
      "evidence": [
        {"kind": "PR", "url": "https://github.com/org/repo/pull/1234"}
      ],
      "summary": "Right-sizing reduced steady-state cost by 18%."
    }
  ],
  "activity_feed": [
    {"kind": "commit", "repo": "org/api", "sha": "abc123", "url": "https://github.com/org/api/commit/abc123", "ts": "2025-06-10"},
    {"kind": "post", "title": "Runbooks that donâ€™t rot", "url": "https://substack.example.com/p/runbooks", "ts": "2025-05-22"}
  ],
  "meta": {"updated_at": "2025-08-18", "license": "CC BY 4.0"}
}
